{
  "schemaVersion": "1.0",
  "workflow": {},
  "nodes": [
    {
      "id": "t_manual",
      "type": "trigger.manual",
      "label": "Start",
      "position": { "x": 80, "y": 120 },
      "config": {}
    },
    {
      "id": "h1",
      "type": "action.http",
      "label": "GET example.com",
      "position": { "x": 380, "y": 120 },
      "config": { "method": "GET", "url": "https://example.com" }
    }
  ],
  "edges": [
    {
      "id": "e1",
      "source": "t_manual",
      "target": "h1",
      "sourceHandle": "main",
      "targetHandle": "main",
      "type": "success"
    }
  ]
}
