{
  "schemaVersion": "1.0",
  "workflow": {},
  "nodes": [
    {
      "id": "t_manual",
      "type": "trigger.manual",
      "label": "Start",
      "position": { "x": 80, "y": 120 },
      "config": {}
    },
    {
      "id": "s_raw",
      "type": "logic.set",
      "label": "JSON text",
      "position": { "x": 340, "y": 120 },
      "config": { "values": { "raw": "{\"hello\":\"world\"}" } }
    },
    {
      "id": "j1",
      "type": "logic.json",
      "label": "Parse",
      "position": { "x": 600, "y": 120 },
      "config": { "operation": "parse", "input": "{{$json.raw}}" }
    }
  ],
  "edges": [
    {
      "id": "e1",
      "source": "t_manual",
      "target": "s_raw",
      "sourceHandle": "main",
      "targetHandle": "main",
      "type": "success"
    },
    {
      "id": "e2",
      "source": "s_raw",
      "target": "j1",
      "sourceHandle": "main",
      "targetHandle": "main",
      "type": "success"
    }
  ]
}
