{
  "schemaVersion": "1.0",
  "workflow": {},
  "nodes": [
    {
      "id": "t_manual",
      "type": "trigger.manual",
      "label": "Start",
      "position": { "x": 80, "y": 120 },
      "config": {}
    },
    {
      "id": "str1",
      "type": "logic.string",
      "label": "Uppercase",
      "position": { "x": 380, "y": 120 },
      "config": { "operation": "upper", "input": "knot" }
    }
  ],
  "edges": [
    {
      "id": "e1",
      "source": "t_manual",
      "target": "str1",
      "sourceHandle": "main",
      "targetHandle": "main",
      "type": "success"
    }
  ]
}
